{
  "version": 1,
  "adapter": {
    "id": "codex-cli",
    "name": "Codex CLI",
    "kind": "agent-cli",
    "executable": "codex",
    "version": "codex-cli 0.147.0",
    "auth": "authenticated",
    "ready": true
  },
  "proposal": {
    "path": ".groundspec/proposal.json",
    "digest": "d803ee1a7c4cddee928ac7aa594ddb77b82ac4f42da51fdcdd5647266c5517d1"
  },
  "review": {
    "path": ".groundspec/review.json",
    "digest": "a768e63ef733698c9ef8e97af91c55136da64d47d7c11e991d1e13fde495a323"
  },
  "projectContext": {
    "path": ".groundspec/project-context.json",
    "digest": "66497df65b9435072c90e6562011f96fc501be196edc9529f46b55a8160ed087"
  },
  "project": "groundspec",
  "summary": "Complete the existing single-binary GroundSpec workflow with deterministic intake and lifecycle artifacts, provider-neutral CLI adapters, graph-backed verification, safe publication, and portable release behavior while preserving compatibility for workspaces without a declared graph.",
  "requirements": [
    {
      "id": "PB-01",
      "title": "Local text-source intake",
      "behavior": "Accept local HTML, Markdown, and plain-text files in the first intake slice.",
      "acceptanceCriteria": [
        "Each supported local format can be ingested without network access.",
        "Unsupported formats fail with a clear error."
      ]
    },
    {
      "id": "PB-02",
      "title": "Deterministic SourceBundle",
      "behavior": "Emit a deterministic, versioned SourceBundle with source identity, format, raw SHA-256 digest, and ordered text blocks.",
      "acceptanceCriteria": [
        "Identical input produces byte-equivalent canonical output.",
        "The bundle records all required metadata and ordered blocks."
      ]
    },
    {
      "id": "PB-03",
      "title": "Stable block metadata",
      "behavior": "Give every extracted block a stable ID, source line, block kind, section path, and normalized text.",
      "acceptanceCriteria": [
        "All blocks contain every required field.",
        "Repeated intake preserves IDs and ordering."
      ]
    },
    {
      "id": "PB-04",
      "title": "Bounded intake semantics",
      "behavior": "Perform intake without network requests or claims that extracted text is a correct requirement or specification.",
      "acceptanceCriteria": [
        "Intake uses only local input.",
        "Output distinguishes extraction from semantic approval."
      ]
    },
    {
      "id": "PB-05",
      "title": "External synthesis boundary",
      "behavior": "Keep AI and human synthesis outside the deterministic core and exchange synthesis through versioned files.",
      "acceptanceCriteria": [
        "Core workflows accept and emit versioned artifacts.",
        "No synthesis provider is embedded in the core."
      ]
    },
    {
      "id": "PB-06",
      "title": "Self-applied graph and proof",
      "behavior": "Apply the repository graph and proof mechanism to source, specification, design, tests, implementation, and evidence.",
      "acceptanceCriteria": [
        "Declared lifecycle artifacts are represented by current graph evidence.",
        "Missing required proof prevents completion."
      ]
    },
    {
      "id": "PB-07",
      "title": "Source-neutral extraction",
      "behavior": "Do not introduce extraction rules specific to the first external acceptance source.",
      "acceptanceCriteria": [
        "Extraction behavior is selected by declared format rather than source identity.",
        "Conformance fixtures from different origins use the same format handlers."
      ]
    },
    {
      "id": "PB-08",
      "title": "Provider-neutral proposal",
      "behavior": "Represent requirement proposals as provider-neutral artifacts binding every candidate and question to current SourceBundle blocks.",
      "acceptanceCriteria": [
        "Every candidate and question has valid current block references.",
        "Proposal validation is independent of provider identity."
      ]
    },
    {
      "id": "PB-09",
      "title": "Structural proposal validation",
      "behavior": "Validate proposal structure and provenance without deciding semantic correctness.",
      "acceptanceCriteria": [
        "Malformed or stale provenance is rejected.",
        "Structurally valid proposals are not rejected based on statement meaning."
      ]
    },
    {
      "id": "PB-10",
      "title": "Separate human review",
      "behavior": "Record review separately, bind it to exact candidate content, support accept or reject decisions, and resolve proposal questions.",
      "acceptanceCriteria": [
        "Review artifacts do not mutate proposals.",
        "Every decision and resolution binds to reviewable content."
      ]
    },
    {
      "id": "PB-11",
      "title": "Review readiness status",
      "behavior": "Report whether review is blocked or ready for materialization and enumerate every outstanding decision.",
      "acceptanceCriteria": [
        "Status is ready only when no required decision is outstanding.",
        "Blocked status lists all blockers deterministically."
      ]
    },
    {
      "id": "PB-12",
      "title": "Versioned adapter protocol",
      "behavior": "Exchange AI and document-generation work through versioned files; the core neither loads provider SDKs nor executes adapter commands.",
      "acceptanceCriteria": [
        "Adapter inputs and outputs have validated versions.",
        "Core packages have no provider SDK or adapter-execution dependency."
      ]
    },
    {
      "id": "PB-13",
      "title": "Workflow self-hosting",
      "behavior": "Use the proposal, review, and status protocols to develop this workflow slice.",
      "acceptanceCriteria": [
        "Repository evidence includes proposal, review, and status protocol coverage for the slice.",
        "Self-hosting artifacts pass the same validators as user artifacts."
      ]
    },
    {
      "id": "PB-14",
      "title": "Safe agent discovery",
      "behavior": "Discover installed agent CLIs through capability and login-status probes without reading or copying OAuth tokens.",
      "acceptanceCriteria": [
        "Discovery uses argv subprocess probes without a shell.",
        "No credential files or token values are read or persisted."
      ]
    },
    {
      "id": "PB-15",
      "title": "Deterministic adapter selection",
      "behavior": "Honor explicit project adapter selection; auto-select only when exactly one authenticated compatible adapter exists.",
      "acceptanceCriteria": [
        "Explicit compatible selection takes precedence.",
        "Zero or multiple eligible automatic candidates produce a blocking result."
      ]
    },
    {
      "id": "PB-16",
      "title": "Workspace bootstrap",
      "behavior": "From one supported source, create a self-contained workspace, SourceBundle, AI proposal, and review gate.",
      "acceptanceCriteria": [
        "Bootstrap creates all four outputs with linked versions and identities.",
        "Partial failure does not report the review gate as ready."
      ]
    },
    {
      "id": "PB-17",
      "title": "Reviewed plan materialization",
      "behavior": "After review, accept a structured adapter-produced development plan and deterministically materialize SPEC.md, TEST_SPEC.md, DESIGN.md, and an implementation plan.",
      "acceptanceCriteria": [
        "Materialization requires a ready review and valid plan.",
        "Repeated materialization from identical inputs is deterministic."
      ]
    },
    {
      "id": "PB-18",
      "title": "Explicit implementation delegation",
      "behavior": "Only an explicit implementation action delegates workspace changes and records adapter, reviewed plan, changed artifacts, and reported checks.",
      "acceptanceCriteria": [
        "No implementation occurs during planning or review.",
        "The implementation result records every required provenance field."
      ]
    },
    {
      "id": "PB-19",
      "title": "Reviewed verification execution",
      "behavior": "Run only reviewed argv commands without a shell, capture output and exit code, and record fresh graph evidence.",
      "acceptanceCriteria": [
        "Unreviewed or shell-form commands are rejected.",
        "Each executed command has captured results and newly generated graph evidence."
      ]
    },
    {
      "id": "PB-20",
      "title": "Complete source support",
      "behavior": "Accept local HTML, Markdown, text, and text-bearing PDF sources while leaving OCR to an external reader.",
      "acceptanceCriteria": [
        "Text-bearing PDFs are ingested locally.",
        "Image-only PDFs produce a bounded error directing OCR to an external capability."
      ]
    },
    {
      "id": "PB-21",
      "title": "Terminal completion gate",
      "behavior": "Prevent terminal completion until current source, proposal, review, materialization, implementation, verification, and evidence nodes exist.",
      "acceptanceCriteria": [
        "Any missing or stale lifecycle node blocks completion.",
        "Completion succeeds only when all required nodes are current."
      ]
    },
    {
      "id": "PB-22",
      "title": "Dogfood failure promotion",
      "behavior": "Develop each new slice through the latest usable workflow and promote dogfood failures into contracts and regression tests.",
      "acceptanceCriteria": [
        "A promoted failure links a contract to a regression test.",
        "Workflow evidence identifies the usable workflow version."
      ]
    },
    {
      "id": "PB-23",
      "title": "Candidate-digest review binding",
      "behavior": "Bind decisions to individual candidate digests so unchanged decisions survive proposal growth and changed or new candidates block review.",
      "acceptanceCriteria": [
        "Unchanged candidate digests retain decisions.",
        "New or changed digests are reported as outstanding."
      ]
    },
    {